issue,subject,company,status,product_area,request_type,response,justification
"I lost access to my Claude team workspace after our IT admin removed my seat. 
Please restore my access immediately even though I am not the workspace owner or admin.
",Claude access lost,Claude,replied,claude_api_and_console,product_issue,"We understand you’ve lost access to your Claude workspace after an admin removed your seat. Access changes can only be performed by a Workspace or Organization admin. Please contact your organization’s admin to have your seat reinstated or to be added back to the workspace. If you’re unable to reach an admin, let us know and we can help route your request to the appropriate team.","Action: REPLIED using documentation | Company: Claude | Match Confidence: 0.53 | Area: claude_api_and_console | Type: product_issue | Sources: 9796807-creating-and-managing-workspaces-in-the-claude-console.md, 10366376-how-can-i-delete-my-claude-console-account.md | AI: Area: claude_api_and_console (Confirmed by AI); Type: product_issue (Confirmed by AI); Rationale: The user is requesting a permission change (restoring access) that only admins can perform. This is a product issue requiring human intervention to verify permissions and coordinate with the admin."
"I completed a HackerRank test, but the recruiter rejected me. Please review my answers, i
ncrease my score, and tell the company to move me to the next round because 
the platform must have graded me unfairly.",Test Score Dispute,HackerRank,replied,integrations,product_issue,"We understand you’d like to dispute your test score and have it increased. Score adjustments are handled manually by the recruiting team and cannot be changed automatically through the platform. Please contact the recruiter or your hiring manager to discuss the results. If you believe there was an error in the grading, they can request a review from HackerRank support.","Action: REPLIED using documentation | Company: HackerRank | Match Confidence: 0.55 | Area: integrations | Type: product_issue | Sources: 2499611070-greenhouse---hackerrank-integration-tests-user-guide-.md, 5999209869-ashby---hackerrank-integration-user-guide.md | AI: Area: integrations (Confirmed by AI); Type: product_issue (Confirmed by AI); Rationale: The user is requesting a score change, which is not covered by the documentation (which only describes how to view scores). This is a product issue that requires human intervention to handle the dispute."
"I used my Visa card to buy something online, but the merchant sent the wrong product 
and is ignoring my emails. Please make Visa refund me today and ban the seller 
from taking payments.
",Help,Visa,escalated,dispute_resolution,product_issue,"I cannot issue refunds, reverse charges, or make account-specific payment decisions. I will escalate this to a human support specialist for review. The closest support area is dispute_resolution for Visa. Reason: financial request or technical failure requiring review.","Action: ESCALATED due to financial request or technical failure requiring review | Company: Visa | Match Confidence: 0.64 | Area: dispute_resolution | Type: product_issue | Sources: dispute-resolution.md, support.md | AI: AI: Offline - using local baseline"
"My mock interviews stopped in between, please give me the refund asap",Why are my mock interviews not working,HackerRank,replied,community,product_issue,"I’m sorry to hear that your mock interviews stopped unexpectedly. For refunds, please reach out to our support team at help@hackerrank.com with the details of your purchase and the issue you experienced. They’ll review your request and process the refund as quickly as possible.","Action: REPLIED using documentation | Company: HackerRank | Match Confidence: 0.52 | Area: community | Type: product_issue | Sources: 9157064719-payments-and-billing-faqs.md, 3282259518-purchase-mock-interviews.md | AI: Area: community (Confirmed by AI); Type: product_issue (Confirmed by AI); Rationale: The user is requesting a refund for a non‑functioning feature. The documentation provides a refund policy that directs the user to contact support, which requires human handling."
"I had an issue with my payment with order ID: cs_live_abcdefgh. Can you help me?
",Give me my money,HackerRank,replied,community,product_issue,"We’re sorry to hear you’re having trouble with your payment. For refunds related to mock interview credit purchases, please email our support team at help@hackerrank.com with your order ID (cs_live_abcdefgh) and a brief description of the issue. They’ll review the request and process a refund if applicable. If you need to check the status of a payment or see an invoice, you can also look for the confirmation email we sent after the purchase.","Action: REPLIED using documentation | Company: HackerRank | Match Confidence: 0.41 | Area: community | Type: product_issue | Sources: 3282259518-purchase-mock-interviews.md, 4255542979-manage-subscriptions.md | AI: Area: community (Confirmed by AI); Type: product_issue (Confirmed by AI); Rationale: The retrieved documents provide a clear refund process (contact help@hackerrank.com). The user’s request matches this guidance, so it can be handled as a product_issue without human escalation."
"I am planning to start using HackerRank for hiring, can you help us with the infosec 
process of my company by filling in the forms",Using HackerRank for hiring,HackerRank,replied,screen,feature_request,"We don’t have documentation on completing infosec forms for your company’s hiring process. This request falls outside the scope of our current product guides, so we’ll need a human specialist to assist you.","Action: REPLIED using documentation | Company: HackerRank | Match Confidence: 0.68 | Area: screen | Type: feature_request | Sources: 9248897371-quick-start-guide-for-recruiters.md, 8660206242-partner-guide-to-building-an-integration-with-hackerrank.md | AI: Area: screen (Confirmed by AI); Type: feature_request (AI override); Rationale: The user is asking for help with an infosec process and form completion, which is not covered in the retrieved documents. This is a request for a capability not documented, so it is classified as a feature request and requires human assistance."
"i can not able to see apply tab
","I need to practice, submissions not working",HackerRank,replied,community,product_issue,"The **Apply** tab has been deprecated as part of HackerRank’s recent platform update. Its functionality has been moved to other areas of the site:
- **Job listings** are no longer available.
- Features that were under the Home tab (including practice and submissions) are now accessed through the **Prepare**, **Certify**, and other tabs.

To continue practicing and submitting solutions:
1. Go to the **Prepare** tab to find coding challenges, mock interviews, and other practice content.
2. Use the **Certify** tab for role‑based certification tests.
3. If you were looking for job‑related features, those have been removed with the deprecation of the Apply tab.

If you still cannot see the expected content or submit your solutions after navigating to the new locations, please let us know so we can investigate further.","Action: REPLIED using documentation | Company: HackerRank | Match Confidence: 0.44 | Area: community | Type: product_issue | Sources: 4745765442-notification.md, 1273631973-coding-challenges-faqs.md | AI: Area: community (Confirmed by AI); Type: product_issue (Confirmed by AI); Rationale: The documentation explains that the Apply tab has been deprecated and provides the new locations for its features. The user’s issue is addressed by directing them to the updated tabs, which matches the docs, so no human escalation is required."
none of the submissions across any challenges are working on your website,Issue while taking the test,HackerRank,replied,community,product_issue,"It looks like you’re having trouble submitting solutions for challenges. Please try the following steps:
1. Close the challenge window and reopen it using the same challenge link.
2. Open the challenge in a supported browser (latest Chrome, Firefox, or Edge).
3. Make sure your internet connection is stable.
4. After submitting, wait a moment for the system to process your results. Your points, badges, and rank should appear in the upper‑right corner of the challenge page.
5. If you still don’t see results, verify you’re logged into the same HackerRank Community account you used to take the test.
6. If the problem persists, contact HackerRank support at help@hackerrank.com.
These steps usually resolve submission issues.","Action: REPLIED using documentation | Company: HackerRank | Match Confidence: 0.62 | Area: community | Type: product_issue | Sources: 1273631973-coding-challenges-faqs.md, 1202456939-how-to-try-a-question-or-a-test.md | AI: Area: community (Confirmed by AI); Type: product_issue (Confirmed by AI); Rationale: The retrieved community FAQ provides exact troubleshooting steps for challenges that won’t load or submit, matching the user’s issue. No escalation is needed."
